{"schema_version":"1.0.0","scope":"gdscript","outcome":"PASS","engine_version":"4.7.2.stable.official.ed1daf0bf","tests":[{"id":"starter-scene-ui","outcome":"PASS","summary":"The playable scene and its complete UI instantiate."},{"id":"localized-resource","outcome":"PASS","summary":"A localized resource path loads correctly."},{"id":"signal-flow","outcome":"PASS","summary":"Gameplay emits the score and goal through its public signal."},{"id":"input-action","outcome":"PASS","summary":"The playable keyboard action is available through Godot's standard input map."},{"id":"gameplay-loop","outcome":"PASS","summary":"The collect-to-goal loop reaches one terminal win and rejects extra scoring."},{"id":"reset-flow","outcome":"PASS","summary":"A completed game resets into a playable new round."}]}
